{
  "schema_version": "alice.source_plan.v1",
  "source_plan_id": "33767d9e-94d2-5a96-9b33-943cbd2a8839",
  "request_id": "98df68eb-684b-4bec-b34b-8155a7fa1f39",
  "subject_resolution_id": "0a6f8866-1833-53af-a3be-e639f0fb46a6",
  "jurisdiction_context_id": "3ee368ef-484c-5574-92a6-cd586877303e",
  "coverage_assessment_id": "2d8a38ce-b5d2-5977-9e86-30772cf897fd",
  "plan_status": "partially_blocked",
  "request_mode": "deep_research",
  "active_use_cases": [
    "residential_light_development",
    "recreational_rural_hold"
  ],
  "required_capabilities": [
    "parcel_identity",
    "parcel_geometry",
    "tax_roll",
    "zoning",
    "planning_docs",
    "environmental_baseline",
    "utilities",
    "market_context"
  ],
  "planned_source_groups": [
    {
      "capability": "environmental_baseline",
      "subject_ids": [
        "subject-1"
      ],
      "source_ids": [
        "federal_fema_nfhl",
        "federal_usfws_nwi",
        "federal_usda_soil_data_access",
        "federal_usgs_3dep_elevation",
        "federal_epa_ejscreen"
      ],
      "source_selection_rationale": "Start with FEMA National Flood Hazard Layer because national baseline overlays should be retrieved before narrower parcel-specific interpretation.",
      "priority_order": 6,
      "authority_level": "official_federal",
      "execution_preconditions": [
        "a defensible geography anchor such as county, state, or coordinates must be present"
      ],
      "fallback_if_missing": [
        "If one national overlay is degraded, continue with the remaining federal baseline sources and record the missing layer explicitly."
      ],
      "group_status": "ready",
      "notes": [
        "Environmental baseline uses federal overlays even when county-local depth is thin."
      ]
    },
    {
      "capability": "utilities",
      "subject_ids": [
        "subject-1"
      ],
      "source_ids": [
        "federal_fcc_bdc_national"
      ],
      "source_selection_rationale": "Start with FCC Broadband Data Collection Nationwide Downloads because the effective county registry prefers this source for utilities in the current jurisdiction.",
      "priority_order": 7,
      "authority_level": "official_federal",
      "execution_preconditions": [
        "at least state-level geography should be stable before infrastructure retrieval begins"
      ],
      "fallback_if_missing": [
        "If local utility service areas are unclear, fall back to statewide utility maps and keep service conclusions directional."
      ],
      "group_status": "ready",
      "notes": [
        "State-level infrastructure sources are available, but local feasibility remains directional."
      ]
    },
    {
      "capability": "market_context",
      "subject_ids": [
        "subject-1"
      ],
      "source_ids": [
        "listing_platform_land_com"
      ],
      "source_selection_rationale": "Start with Land.com Listings because listing-platform context is the fastest supported way to recover seller-facing listing or market clues for this capability.",
      "priority_order": 8,
      "authority_level": "platform",
      "execution_preconditions": [
        "listing URL inputs remain in the active subject set"
      ],
      "fallback_if_missing": [
        "If one listing platform is missing, use the remaining listing or market context sources and mark any platform-specific gaps."
      ],
      "group_status": "ready",
      "notes": [
        "Listing inputs already provide a directional market context entry point."
      ]
    }
  ],
  "deferred_steps": [],
  "blocked_steps": [
    {
      "capability": "parcel_identity",
      "subject_ids": [
        "subject-1"
      ],
      "blocker_type": "local_source_gap",
      "reason": "No registered source currently supports parcel_identity strongly enough for this context.",
      "dependency": null
    },
    {
      "capability": "parcel_geometry",
      "subject_ids": [
        "subject-1"
      ],
      "blocker_type": "local_source_gap",
      "reason": "No registered source currently supports parcel_geometry strongly enough for this context.",
      "dependency": null
    },
    {
      "capability": "tax_roll",
      "subject_ids": [
        "subject-1"
      ],
      "blocker_type": "local_source_gap",
      "reason": "No registered source currently supports tax_roll strongly enough for this context.",
      "dependency": null
    },
    {
      "capability": "zoning",
      "subject_ids": [
        "subject-1"
      ],
      "blocker_type": "local_source_gap",
      "reason": "No registered source currently supports zoning strongly enough for this context.",
      "dependency": null
    },
    {
      "capability": "planning_docs",
      "subject_ids": [
        "subject-1"
      ],
      "blocker_type": "local_source_gap",
      "reason": "No registered source currently supports planning_docs strongly enough for this context.",
      "dependency": null
    }
  ],
  "missing_capabilities": [
    "parcel_identity",
    "parcel_geometry",
    "tax_roll",
    "zoning",
    "planning_docs"
  ],
  "notes": [
    "This artifact is a retrieval plan only. No live source fetches have been executed in Step 5.",
    "Current source plan is dominated by federal baseline sources because local coverage is still thin."
  ],
  "generated_at": "2026-04-16T22:41:38.438179Z"
}