{
  "schema_version": "alice.source_plan.v1",
  "source_plan_id": "c876b956-e3b2-5508-baec-215cae8f5fe3",
  "request_id": "0c54d98f-64e2-4f12-8ae2-4b2947bd4b11",
  "subject_resolution_id": "2874761c-7b54-56ad-afb7-95a2d7e32409",
  "jurisdiction_context_id": "b0f8d1b3-4bf1-5b33-878a-733bcad1e423",
  "coverage_assessment_id": "5a24afe4-dd58-5905-920c-617ccc04586a",
  "plan_status": "partially_blocked",
  "request_mode": "deep_research",
  "active_use_cases": [
    "agriculture",
    "recreational_rural_hold"
  ],
  "required_capabilities": [
    "parcel_identity",
    "parcel_geometry",
    "tax_roll",
    "zoning",
    "planning_docs",
    "environmental_baseline",
    "water_signals"
  ],
  "planned_source_groups": [
    {
      "capability": "parcel_geometry",
      "subject_ids": [
        "subject-address-1"
      ],
      "source_ids": [
        "state_tx_stratmap_land_parcels"
      ],
      "source_selection_rationale": "Start with Texas StratMap Land Parcels because it is the strongest currently registered source group for parcel_geometry given the present jurisdiction footing.",
      "priority_order": 2,
      "authority_level": "official_state",
      "execution_preconditions": [
        "county_fips must be stable before this local source group runs"
      ],
      "fallback_if_missing": [
        "If county geometry is unavailable, fall back to statewide parcel datasets or keep geometry unresolved."
      ],
      "group_status": "ready",
      "notes": [
        "Statewide parcel geometry may help later, but county attachment is still missing."
      ]
    },
    {
      "capability": "environmental_baseline",
      "subject_ids": [
        "subject-address-1"
      ],
      "source_ids": [
        "federal_usfws_nwi",
        "federal_fema_nfhl",
        "federal_usda_soil_data_access",
        "federal_usgs_3dep_elevation",
        "federal_epa_ejscreen"
      ],
      "source_selection_rationale": "Start with U.S. Fish and Wildlife Service National Wetlands Inventory because national baseline overlays should be retrieved before narrower parcel-specific interpretation.",
      "priority_order": 6,
      "authority_level": "official_federal",
      "execution_preconditions": [
        "a defensible geography anchor such as county, state, or coordinates must be present"
      ],
      "fallback_if_missing": [
        "If one national overlay is degraded, continue with the remaining federal baseline sources and record the missing layer explicitly."
      ],
      "group_status": "ready",
      "notes": [
        "Only national baseline overlays are currently attachable."
      ]
    },
    {
      "capability": "water_signals",
      "subject_ids": [
        "subject-address-1"
      ],
      "source_ids": [
        "federal_usda_soil_data_access"
      ],
      "source_selection_rationale": "Start with USDA NRCS Soil Data Access because it is the strongest currently registered source group for water_signals given the present jurisdiction footing.",
      "priority_order": 7,
      "authority_level": "official_federal",
      "execution_preconditions": [
        "a defensible geography anchor such as county, state, or coordinates must be present"
      ],
      "fallback_if_missing": [
        "If local water-rights sources are absent, use soils and other baseline signals only as directional context."
      ],
      "group_status": "ready",
      "notes": [
        "Current water or agriculture footing is directional and mostly baseline-level."
      ]
    }
  ],
  "deferred_steps": [],
  "blocked_steps": [
    {
      "capability": "parcel_identity",
      "subject_ids": [
        "subject-address-1"
      ],
      "blocker_type": "county_required",
      "reason": "parcel_identity is blocked because jurisdiction is not stable enough yet.",
      "dependency": "county_fips"
    },
    {
      "capability": "tax_roll",
      "subject_ids": [
        "subject-address-1"
      ],
      "blocker_type": "county_required",
      "reason": "tax_roll is blocked because jurisdiction is not stable enough yet.",
      "dependency": "county_fips"
    },
    {
      "capability": "zoning",
      "subject_ids": [
        "subject-address-1"
      ],
      "blocker_type": "county_required",
      "reason": "zoning is blocked because jurisdiction is not stable enough yet.",
      "dependency": "county_fips"
    },
    {
      "capability": "planning_docs",
      "subject_ids": [
        "subject-address-1"
      ],
      "blocker_type": "county_required",
      "reason": "planning_docs is blocked because jurisdiction is not stable enough yet.",
      "dependency": "county_fips"
    }
  ],
  "missing_capabilities": [
    "parcel_identity",
    "tax_roll",
    "zoning",
    "planning_docs"
  ],
  "notes": [
    "This artifact is a retrieval plan only. No live source fetches have been executed in Step 5."
  ],
  "generated_at": "2026-04-16T22:43:47.149613Z"
}
