{
  "schema_version": "alice.source_plan.v1",
  "source_plan_id": "a77d4011-c9a5-55e6-a45e-70f440029f95",
  "request_id": "b71f5ba1-f08d-447b-a91a-2a31724cd2f3",
  "subject_resolution_id": "c964d9cd-9df1-5d50-a1a6-0f5857d31e74",
  "jurisdiction_context_id": "e4420bac-f9d1-525b-9d48-16ab4962ee9b",
  "coverage_assessment_id": "9986223f-78f5-5ea3-be06-2a459117eb37",
  "plan_status": "partially_blocked",
  "request_mode": "deep_research",
  "active_use_cases": [
    "energy",
    "recreational_rural_hold"
  ],
  "required_capabilities": [
    "parcel_identity",
    "parcel_geometry",
    "tax_roll",
    "zoning",
    "planning_docs",
    "environmental_baseline",
    "utilities",
    "transmission",
    "market_context"
  ],
  "planned_source_groups": [
    {
      "capability": "parcel_identity",
      "subject_ids": [
        "subject-1"
      ],
      "source_ids": [
        "county_tx_hudspeth_cad_property_search",
        "county_tx_hudspeth_cad_public_information",
        "state_tx_stratmap_land_parcels"
      ],
      "source_selection_rationale": "Start with Hudspeth Appraisal District Property Search because the effective county registry prefers this source for parcel_identity in the current jurisdiction.",
      "priority_order": 1,
      "authority_level": "mixed",
      "execution_preconditions": [
        "county_fips must be stable before this local source group runs",
        "subject must retain at least one parcel clue such as APN, address, listing URL, or inherited parcel reference"
      ],
      "fallback_if_missing": [
        "If county parcel search is missing, fall back to statewide parcel programs where available or request explicit county/APN clarification."
      ],
      "group_status": "ready",
      "notes": []
    },
    {
      "capability": "parcel_geometry",
      "subject_ids": [
        "subject-1"
      ],
      "source_ids": [
        "state_tx_stratmap_land_parcels"
      ],
      "source_selection_rationale": "Start with Texas StratMap Land Parcels because the effective county registry prefers this source for parcel_geometry in the current jurisdiction.",
      "priority_order": 2,
      "authority_level": "official_state",
      "execution_preconditions": [
        "county_fips must be stable before this local source group runs"
      ],
      "fallback_if_missing": [
        "If county geometry is unavailable, fall back to statewide parcel datasets or keep geometry unresolved."
      ],
      "group_status": "ready",
      "notes": []
    },
    {
      "capability": "tax_roll",
      "subject_ids": [
        "subject-1"
      ],
      "source_ids": [
        "county_tx_hudspeth_cad_property_search",
        "county_tx_hudspeth_cad_public_information"
      ],
      "source_selection_rationale": "Start with Hudspeth Appraisal District Property Search because the effective county registry prefers this source for tax_roll in the current jurisdiction.",
      "priority_order": 3,
      "authority_level": "official_local_or_county",
      "execution_preconditions": [
        "county_fips must be stable before this local source group runs"
      ],
      "fallback_if_missing": [
        "If tax roll access is missing, keep assessed value and ownership context unresolved until a county source is added."
      ],
      "group_status": "ready",
      "notes": []
    },
    {
      "capability": "planning_docs",
      "subject_ids": [
        "subject-1"
      ],
      "source_ids": [
        "county_tx_hudspeth_forms_and_applications"
      ],
      "source_selection_rationale": "Start with Hudspeth County Forms and Applications because it is the strongest currently registered source group for planning_docs given the present jurisdiction footing.",
      "priority_order": 5,
      "authority_level": "official_local_or_county",
      "execution_preconditions": [
        "county_fips must be stable before this local source group runs"
      ],
      "fallback_if_missing": [
        "If local planning documents are thin, rely on county procedural pages and keep entitlement interpretation conservative."
      ],
      "group_status": "ready",
      "notes": []
    },
    {
      "capability": "environmental_baseline",
      "subject_ids": [
        "subject-1"
      ],
      "source_ids": [
        "federal_fema_nfhl",
        "federal_usfws_nwi",
        "federal_usda_soil_data_access",
        "federal_usgs_3dep_elevation",
        "federal_epa_ejscreen"
      ],
      "source_selection_rationale": "Start with FEMA National Flood Hazard Layer because national baseline overlays should be retrieved before narrower parcel-specific interpretation.",
      "priority_order": 6,
      "authority_level": "official_federal",
      "execution_preconditions": [
        "a defensible geography anchor such as county, state, or coordinates must be present"
      ],
      "fallback_if_missing": [
        "If one national overlay is degraded, continue with the remaining federal baseline sources and record the missing layer explicitly."
      ],
      "group_status": "ready",
      "notes": [
        "Environmental baseline uses federal overlays even when county-local depth is thin."
      ]
    },
    {
      "capability": "utilities",
      "subject_ids": [
        "subject-1"
      ],
      "source_ids": [
        "state_tx_puc_electricity_maps",
        "federal_fcc_bdc_national"
      ],
      "source_selection_rationale": "Start with Texas PUC Electricity Maps because the effective county registry prefers this source for utilities in the current jurisdiction.",
      "priority_order": 7,
      "authority_level": "mixed",
      "execution_preconditions": [
        "at least state-level geography should be stable before infrastructure retrieval begins"
      ],
      "fallback_if_missing": [
        "If local utility service areas are unclear, fall back to statewide utility maps and keep service conclusions directional."
      ],
      "group_status": "ready",
      "notes": []
    },
    {
      "capability": "transmission",
      "subject_ids": [
        "subject-1"
      ],
      "source_ids": [
        "state_tx_puc_electricity_maps"
      ],
      "source_selection_rationale": "Start with Texas PUC Electricity Maps because the effective county registry prefers this source for transmission in the current jurisdiction.",
      "priority_order": 8,
      "authority_level": "official_state",
      "execution_preconditions": [
        "at least state-level geography should be stable before infrastructure retrieval begins"
      ],
      "fallback_if_missing": [
        "If state or local transmission context is thin, retain transmission proximity as a directional screen only."
      ],
      "group_status": "ready",
      "notes": []
    },
    {
      "capability": "market_context",
      "subject_ids": [
        "subject-1"
      ],
      "source_ids": [
        "listing_platform_landwatch"
      ],
      "source_selection_rationale": "Start with LandWatch Listings because listing-platform context is the fastest supported way to recover seller-facing listing or market clues for this capability.",
      "priority_order": 9,
      "authority_level": "platform",
      "execution_preconditions": [
        "listing URL inputs remain in the active subject set"
      ],
      "fallback_if_missing": [
        "If one listing platform is missing, use the remaining listing or market context sources and mark any platform-specific gaps."
      ],
      "group_status": "ready",
      "notes": [
        "Listing inputs already provide a directional market context entry point."
      ]
    }
  ],
  "deferred_steps": [],
  "blocked_steps": [
    {
      "capability": "zoning",
      "subject_ids": [
        "subject-1"
      ],
      "blocker_type": "local_source_gap",
      "reason": "No registered source currently supports zoning strongly enough for this context.",
      "dependency": null
    }
  ],
  "missing_capabilities": [
    "zoning"
  ],
  "notes": [
    "This artifact is a retrieval plan only. No live source fetches have been executed in Step 5."
  ],
  "generated_at": "2026-04-16T22:40:03.552536Z"
}
