{
  "schema_version": "alice.source_plan.v1",
  "source_plan_id": "ccad83dc-0201-5966-b12b-a7e3ad8b47e1",
  "request_id": "2e69c948-d90f-4d57-ac4a-f1a017bb229d",
  "subject_resolution_id": "9b9e239f-9bd8-5d7d-abd1-e8b9095d38dd",
  "jurisdiction_context_id": "4596b489-87d0-51f9-b786-329486723668",
  "coverage_assessment_id": "618942ce-f133-5ddc-a4ae-07fb658627f5",
  "plan_status": "blocked",
  "request_mode": "deep_research",
  "active_use_cases": [
    "energy",
    "recreational_rural_hold"
  ],
  "required_capabilities": [
    "parcel_identity",
    "parcel_geometry",
    "tax_roll",
    "zoning",
    "planning_docs",
    "environmental_baseline",
    "utilities",
    "transmission"
  ],
  "planned_source_groups": [],
  "deferred_steps": [],
  "blocked_steps": [
    {
      "capability": "parcel_identity",
      "subject_ids": [
        "subject-1"
      ],
      "blocker_type": "county_required",
      "reason": "parcel_identity is blocked because jurisdiction is not stable enough yet.",
      "dependency": "county_fips"
    },
    {
      "capability": "parcel_geometry",
      "subject_ids": [
        "subject-1"
      ],
      "blocker_type": "county_required",
      "reason": "parcel_geometry is blocked because jurisdiction is not stable enough yet.",
      "dependency": "county_fips"
    },
    {
      "capability": "tax_roll",
      "subject_ids": [
        "subject-1"
      ],
      "blocker_type": "county_required",
      "reason": "tax_roll is blocked because jurisdiction is not stable enough yet.",
      "dependency": "county_fips"
    },
    {
      "capability": "zoning",
      "subject_ids": [
        "subject-1"
      ],
      "blocker_type": "county_required",
      "reason": "zoning is blocked because jurisdiction is not stable enough yet.",
      "dependency": "county_fips"
    },
    {
      "capability": "planning_docs",
      "subject_ids": [
        "subject-1"
      ],
      "blocker_type": "county_required",
      "reason": "planning_docs is blocked because jurisdiction is not stable enough yet.",
      "dependency": "county_fips"
    },
    {
      "capability": "environmental_baseline",
      "subject_ids": [
        "subject-1"
      ],
      "blocker_type": "jurisdiction_unresolved",
      "reason": "environmental_baseline is blocked because jurisdiction is not stable enough yet.",
      "dependency": "stable_geography_anchor"
    },
    {
      "capability": "utilities",
      "subject_ids": [
        "subject-1"
      ],
      "blocker_type": "jurisdiction_unresolved",
      "reason": "utilities is blocked because jurisdiction is not stable enough yet.",
      "dependency": "stable_geography_anchor"
    },
    {
      "capability": "transmission",
      "subject_ids": [
        "subject-1"
      ],
      "blocker_type": "jurisdiction_unresolved",
      "reason": "transmission is blocked because jurisdiction is not stable enough yet.",
      "dependency": "stable_geography_anchor"
    }
  ],
  "missing_capabilities": [
    "parcel_identity",
    "parcel_geometry",
    "tax_roll",
    "zoning",
    "planning_docs",
    "environmental_baseline",
    "utilities",
    "transmission"
  ],
  "notes": [
    "This artifact is a retrieval plan only. No live source fetches have been executed in Step 5.",
    "Current source plan is dominated by federal baseline sources because local coverage is still thin."
  ],
  "generated_at": "2026-04-16T22:41:38.439114Z"
}
