{
  "schema_version": "alice.source_plan.v1",
  "source_plan_id": "cc3a155b-53e4-5672-b377-3b99ba5ae314",
  "request_id": "5c79f5db-53a2-4c49-b50a-8777d7dc1af1",
  "subject_resolution_id": "c29d05e0-3bd5-503a-8455-d3ddff38f082",
  "jurisdiction_context_id": "4784ad6b-97a1-53be-8fb2-16df6bbae9e1",
  "coverage_assessment_id": "676473eb-14e2-533b-950b-844a53aaf04b",
  "plan_status": "ready",
  "request_mode": "deep_research",
  "active_use_cases": [
    "energy",
    "industrial_storage_commercial"
  ],
  "required_capabilities": [
    "parcel_identity",
    "parcel_geometry",
    "tax_roll",
    "zoning",
    "planning_docs",
    "environmental_baseline",
    "utilities",
    "transmission",
    "market_context"
  ],
  "planned_source_groups": [
    {
      "capability": "parcel_identity",
      "subject_ids": [
        "subject-1"
      ],
      "source_ids": [
        "county_ca_kern_parcelquest_property_search",
        "county_ca_kern_interactive_mapping"
      ],
      "source_selection_rationale": "Start with Kern County ParcelQuest Property Search because the effective county registry prefers this source for parcel_identity in the current jurisdiction.",
      "priority_order": 1,
      "authority_level": "official_local_or_county",
      "execution_preconditions": [
        "county_fips must be stable before this local source group runs",
        "subject must retain at least one parcel clue such as APN, address, listing URL, or inherited parcel reference"
      ],
      "fallback_if_missing": [
        "If county parcel search is missing, fall back to statewide parcel programs where available or request explicit county/APN clarification."
      ],
      "group_status": "ready",
      "notes": []
    },
    {
      "capability": "parcel_geometry",
      "subject_ids": [
        "subject-1"
      ],
      "source_ids": [
        "county_ca_kern_interactive_mapping",
        "county_ca_kern_gis_data"
      ],
      "source_selection_rationale": "Start with Kern County Interactive Mapping because the effective county registry prefers this source for parcel_geometry in the current jurisdiction.",
      "priority_order": 2,
      "authority_level": "official_local_or_county",
      "execution_preconditions": [
        "county_fips must be stable before this local source group runs"
      ],
      "fallback_if_missing": [
        "If county geometry is unavailable, fall back to statewide parcel datasets or keep geometry unresolved."
      ],
      "group_status": "ready",
      "notes": []
    },
    {
      "capability": "tax_roll",
      "subject_ids": [
        "subject-1"
      ],
      "source_ids": [
        "county_ca_kern_parcelquest_property_search"
      ],
      "source_selection_rationale": "Start with Kern County ParcelQuest Property Search because the effective county registry prefers this source for tax_roll in the current jurisdiction.",
      "priority_order": 3,
      "authority_level": "official_local_or_county",
      "execution_preconditions": [
        "county_fips must be stable before this local source group runs"
      ],
      "fallback_if_missing": [
        "If tax roll access is missing, keep assessed value and ownership context unresolved until a county source is added."
      ],
      "group_status": "ready",
      "notes": []
    },
    {
      "capability": "zoning",
      "subject_ids": [
        "subject-1"
      ],
      "source_ids": [
        "county_ca_kern_interactive_mapping"
      ],
      "source_selection_rationale": "Start with Kern County Interactive Mapping because the effective county registry prefers this source for zoning in the current jurisdiction.",
      "priority_order": 4,
      "authority_level": "official_local_or_county",
      "execution_preconditions": [
        "county_fips must be stable before this local source group runs"
      ],
      "fallback_if_missing": [
        "If direct zoning visibility is missing, mark zoning unresolved and continue with procedural planning sources only."
      ],
      "group_status": "ready",
      "notes": []
    },
    {
      "capability": "planning_docs",
      "subject_ids": [
        "subject-1"
      ],
      "source_ids": [
        "county_ca_kern_interactive_mapping",
        "local_ca_bakersfield_planning"
      ],
      "source_selection_rationale": "Start with Kern County Interactive Mapping because the effective county registry prefers this source for planning_docs in the current jurisdiction.",
      "priority_order": 5,
      "authority_level": "official_local_or_county",
      "execution_preconditions": [
        "county_fips must be stable before this local source group runs"
      ],
      "fallback_if_missing": [
        "If local planning documents are thin, rely on county procedural pages and keep entitlement interpretation conservative."
      ],
      "group_status": "ready",
      "notes": []
    },
    {
      "capability": "environmental_baseline",
      "subject_ids": [
        "subject-1"
      ],
      "source_ids": [
        "federal_fema_nfhl",
        "federal_usfws_nwi",
        "federal_usda_soil_data_access",
        "federal_usgs_3dep_elevation",
        "federal_epa_ejscreen"
      ],
      "source_selection_rationale": "Start with FEMA National Flood Hazard Layer because national baseline overlays should be retrieved before narrower parcel-specific interpretation.",
      "priority_order": 6,
      "authority_level": "official_federal",
      "execution_preconditions": [
        "a defensible geography anchor such as county, state, or coordinates must be present"
      ],
      "fallback_if_missing": [
        "If one national overlay is degraded, continue with the remaining federal baseline sources and record the missing layer explicitly."
      ],
      "group_status": "ready",
      "notes": [
        "Environmental baseline uses federal overlays even when county-local depth is thin."
      ]
    },
    {
      "capability": "utilities",
      "subject_ids": [
        "subject-1"
      ],
      "source_ids": [
        "federal_fcc_bdc_national"
      ],
      "source_selection_rationale": "Start with FCC Broadband Data Collection Nationwide Downloads because the effective county registry prefers this source for utilities in the current jurisdiction.",
      "priority_order": 7,
      "authority_level": "official_federal",
      "execution_preconditions": [
        "at least state-level geography should be stable before infrastructure retrieval begins"
      ],
      "fallback_if_missing": [
        "If local utility service areas are unclear, fall back to statewide utility maps and keep service conclusions directional."
      ],
      "group_status": "ready",
      "notes": []
    },
    {
      "capability": "transmission",
      "subject_ids": [
        "subject-1"
      ],
      "source_ids": [
        "state_ca_energy_commission_transmission"
      ],
      "source_selection_rationale": "Start with California Electric Transmission Lines because the effective county registry prefers this source for transmission in the current jurisdiction.",
      "priority_order": 8,
      "authority_level": "official_state",
      "execution_preconditions": [
        "at least state-level geography should be stable before infrastructure retrieval begins"
      ],
      "fallback_if_missing": [
        "If state or local transmission context is thin, retain transmission proximity as a directional screen only."
      ],
      "group_status": "ready",
      "notes": []
    },
    {
      "capability": "market_context",
      "subject_ids": [
        "subject-1"
      ],
      "source_ids": [
        "listing_platform_land_com"
      ],
      "source_selection_rationale": "Start with Land.com Listings because listing-platform context is the fastest supported way to recover seller-facing listing or market clues for this capability.",
      "priority_order": 9,
      "authority_level": "platform",
      "execution_preconditions": [
        "listing URL inputs remain in the active subject set"
      ],
      "fallback_if_missing": [
        "If one listing platform is missing, use the remaining listing or market context sources and mark any platform-specific gaps."
      ],
      "group_status": "ready",
      "notes": [
        "Listing inputs already provide a directional market context entry point."
      ]
    }
  ],
  "deferred_steps": [],
  "blocked_steps": [],
  "missing_capabilities": [],
  "notes": [
    "This artifact is a retrieval plan only. No live source fetches have been executed in Step 5."
  ],
  "generated_at": "2026-04-17T08:17:32.842265Z"
}